,id_review,date,product_id,user_rating,date_other_format,user_id,title,review
183,183,20110317,B0029NYQ6A,5,"March 17, 2011",A1PNQBECG6A907,THE GREATEST PADS FOR OVERNIGHT!!!!!!,THESE ARE THE BEST OVERNIGHT PADS............PLUS THEY ARE ON AMAZON FOR A BETTER PRICE THAN MY LOCAL STORES AROUND ME!
203,203,20110929,B0029NYQ9W,5,"September 29, 2011",A2A56MRVND9JVW,"Thin, functional liner","This is the thinnest, most comfortable and functional liner I\'ve found on the market.  120 seems like far too many for any female to need at one time, but they\'re easy to store, each one is individually wrapped, and it\'s a great value."
151,151,20110414,B0029NYQ38,5,"April 14, 2011",A3TP31S61PPE3G,These are so dang comfy - who knew?,So I cannot believe I\'m reviewing a feminine pad. Whatever. I LOVE THESE.They are so comfortable that you will forget they are there. The shape is unique and REALLY fits. You gals know what I\'m talking about when I say the regular pads always bunch up. These just don\'t.These puppies also do NOT stick to you. That\'s another thing that some pads do -these have not stuck once. They are plenty absorbent with absolutely no leakage at all.Once I went to these I just could not go back to any other type. I tried. I really did. In the end I put the other pads in the closet for emergencies and these front and center for monthly use. Highly recommended!
219,220,20100621,B0029NYQCO,5,"June 21, 2010",A2T135XHAH82S4,good product and price from amazon,Good product and price from Amazon (especially with \'subscribe and save\')...Very convenient with delivery...and did I mention much cheaper than in stores???  Very nice service from Amazon!
155,155,20120308,B0029NYQ6A,5,"March 8, 2012",A3HAX53MTOGU7M,The Best Pad for Extra Heavy Periods,"Some women have crazy periods that defy gravity, gushing with the slightest movement or sneeze. If your period is like that or if you find yourself having to wear a tampon and a pad at the same time, these are the perfect pads for you! FIVE STAR all the way!!!!"
182,182,20110331,B0029NYQ6A,3,"March 31, 2011",A1XZKTBWHM3GBW,Work well but full of chemicals,"I used these postpartum with my first child. They worked very well, but the wings could be a bugger to get set right sometimes especially if the folded or something while you put them on.As an alternative, I do recommend cloth pads (there are some really great ones available out there.) They wash up really easy in my experience and you don\'t have to worry about chemicals. I also end up having less leaks, less itchiness etc when using cloth pads.Another alternative that I highly recommend is a menstrual cup. I have a seriously heavy flow and menstrual cups work wonderfully. (I\'m talking about the silicone kind that you wash and reuse)They hold about twice as much flow as a tampon and I wear cloth pads or liners for back up. I can wear a menstrual cup comfortably but I\'m unable to wear tampons. Most tampons are also full of icky chemicals.Natracare is a good brand of disposable menstrual protection that doesn\'t have all the icky chemicals if you just can\'t bring yourself to try the other things or if you need something disposable sometimes."
54,54,20090913,B001LK6QJW,5,"September 13, 2009",A22H3CDC4P8LF,Problem solver,"This product is certainly helpful in the proscribed usage,however, I found it a solution to a problem I have had for several years.  I have had abcesses under both of my arms for at least 3 years and have tried everything in an effort to bandage under my arms.  Underarms are very difficult due to moisture and shape.  Bandaids come off due to moisture and also are very hard on skin tissue.  These have been an absolute Godsend since they have the capacity to absorb the moisture, fit in a difficult area and also stay in place without removing skin upon removal.  Thank you."
114,114,20101203,B0029NYQ1K,5,"December 3, 2010",A9SI2I8F0LB2Z,These are amazing.,"Really.  They\'re incredible.  They absorb thoroughly and almost instantaneously, hold a lot, and are very thin, very soft, and very flexible."
303,306,20110906,B003CP15AE,5,"September 6, 2011",A2YQ2ZI65F37N8,Good product,"These work very well for me.  The sticky back adheres well and so the pad did not bunch, twist or roll, as some other pads have.  Good absorbancy pad without being bulky."
82,82,20100609,B0029NYPXO,5,"June 9, 2010",A1919B5640YE8W,convenient,"The package is thin and easy to carry. Always feel fresh and clean after using, especially in summer."
72,72,20120119,B0029NYPUC,5,"January 19, 2012",A769CQ59B7M26,Always Ultra Thin Slender,"Being a slender woman; these work just fine for me.I would prefer to buy Seventh Generation\'s chlorine free pads but they don\'t have the option of the slender fit.Otherwise, this product works for what\'s necessary."
222,223,20120215,B0029NYQDS,1,"February 15, 2012",A1NZW2XFY7EV9Q,Beware... number of liners in ad is incorrect,"These are advertised and sold as a 2 pack, 72 per box with the total being 144 liners.  It clearly states that in the ad.  What I received was a 2 pack of 36 liners per box, totaling only 72 liners.  I ordered 2 of these 2 packs and expected 288 liners total.  I only received 144 total, so I am going to try to contact the seller to see if they will send me the other 144 liners that I expected and paid for per their ad.  I will upgrade my rating if they do.  Otherwise, buyers beware... the number of liners is clearly incorrect!!!!!"
404,408,20080114,B005P0SMW8,5,"January 14, 2008",ALDCYI1NWWWKL,One of a Kind,Great product.  My wife and I both use this along with a few friends.  Recommend strongly.  No bitter taste.  Give this product 3 weeks consistantly and you will feel the difference.
343,346,20110924,B004J36GES,4,"September 24, 2011",A1AG7F4Z1EOO5L,Comfortable for those not so comfy days!,"For those of us who experience a fairly heavy flow at times, these Always pads really fit the bill.I\'ll rate these pads on the basis of a few key factors.- Comfort: the top layer of these pads are designed so that they won\'t irritate the skin.  I found this to be a huge plus, especially when worn overnight.  No chafing or irritation, even when worn while working out for about an hour.- Reliability: No leaks or staining even with heavy flow.  The channels on the pad help to lock in flow plus I found the pad stays in place very well, especially for a pad without wings.- Thickness: Here\'s where these pads lose some points.  A fellow reviewer compared these to a baby\'s diaper - I agree these are quite thick but willing to accept that for the positive factors above.  For overnight use the thickness of this pad isn\'t too big of a deal, but I wouldn\'t recommend wearing this pad under very tight fitting clothing (then again, maybe tight fitting clothes aren\'t such a good idea for the days you need a super maxi!)"
352,355,20110915,B004J36GES,4,"September 15, 2011",A199FRO0YFMGED,"Good, but not as good the the ultra thin with wings","I normally use \'Ultra Long/Super with Wings, Unscented Thin Pads\' from the same maker. It fits my relatively active life style and protects well overnight. However the wings against the skin bother me a little.This maxi does not have wings and the pad itself is softer. So this is more comfortable. However the protection is not as good without wings, although it is still very absorbent. The odor-lock is a plus."
377,381,20111122,B005P0SMW8,4,"November 22, 2011",AVRNQL0GY4QZ2,Taste like water,"I got George\'s Aloe, 1 Gallon liquid as remedy for my kids (5years and 11 years) digestive system.5 year old does start asking for food and going to bath room regulatory.11 year old also using once a day instead of twice a day. He did not say any changes after taking it.How ever we are happy that it does work on younger kid, which is our main concern.We did recommend same product for my friends family who have less than 6 years old kids.I still need to use it, I will update my review if it does have any benefits on adults."
160,160,20120101,B0029NYQ6A,1,"January 1, 2012",A2AACQZEACXYOL,bad wings,this pads has wost wing ever thay dont stick to what what stickthay not soft the wing bother som much wor pad 2 times the 1 pad  good last over night onb havey flow do not buy it  if y6ou find som other pad work for you
405,409,20080113,B005P0SMW8,1,"January 13, 2008",A3VZBXI6OPC5J8,irritated,I love this product I\'m using it for my Macaws one of which is a feather plucker/chewer it has been working nicely my problem is that I ordered this gal. jug in plenty of time so I wouldn\'t run out and I have NOT received it yet and now you are asking me to rate the service/product. I\'m very frustrated and want my product. Thank-you
1,1,20120314,B0012IYKOG,5,"March 14, 2012",A37553726TM67U,GREAT,"I love the extra protection of length with these pads - I use them in daytime, for they don\'t feel bulky at all.  This is a very good price.  Very happy!"
100,100,20101206,B0029NYPZ2,5,"December 6, 2010",AL77KF4YQVL78,Fresh and Clean,"Always Feminine Wipes are one of my favorite luxuries. Even the softest toilet paper doesn\'t compare to how gently this cleans and refreshes. I prefer Always to other brands because some of the others would dry up and others seemed soggy so, after using it, I had to crouch there for a while to air dry before pulling up my panties. Always is just the right amount, moist enough to clean and refresh while dry enough that I don\'t have to wait before finishing my transaction.I\'m not sure how much is too much information, but let me just say that the comfort these provide is worth it if you suffer from hemorrhoids. They\'re so miserable to clean with scratchy, sand papery toilet paper whereas with Always they\'re a breeze. I know that Preparation H makes their own wipes specifically for that purpose but they\'re so expensive for the one ingredient that they put on the wipes: witch hazel. It\'s so cheap to buy a bottle of witch hazel and squeeze a dollup onto the Always wipe before using it. I only need to use the witch hazel when they\'re really acting up. Usually the wipe is sufficient.The tub isn\'t too tacky looking and fits the wipes perfectly. It also keeps them from drying out. Once in awhile I\'ll accidentally pull out two wipes from the plastic sleeve, which is like facial tissue nearly impossible to get back in and never worth the effort. I\'ll lay the wipe on top of the pack and it will still be moist the next time I open the tub to use it."
223,224,20120102,B0029NYQDS,1,"January 2, 2012",AFJKUBKH42AUL,DO NOT BUY!!!!!,I thought I was buying the 2 pack of 72 liners but I only got a 2 pack of 32 liners. The seller rips you off!!!!
156,156,20120224,B0029NYQ6A,5,"February 24, 2012",A2PI00GYZJBR4W,Maxi Overnight Extra Heavy Flow with Wings Unscented,Thank you to whom every thought to make this pad. I just thought that I was going to be stuck changing my sheets and morning messes for the rest of my period life. When I first tried these I was like these are really long but they really really work. I have no more messes and everything is caught by the pad. I told my friend about them and she laughed at me when I told her how long they were and how they had like 4 wings. I let her try one and she now buys them. I am so glad I found them here so now I can buy more at one time for a cheaper price.
77,77,20100701,B0029NYPUC,5,"July 1, 2010",A2E9BVYJH4YTHY,Better fit for teen and tween girls,"My oldest daughter favors these of all the pads she has tried.  The other ones are too long and bother her.  The problem was that our local stores stopped carrying them for some reason.  (I ordered 6 packages in case they are stopping production or something. I would have ordered more, but I have no where to store them.) My 10 year old just started her period.  These fit her way better than the other pads as well.  I wish that these came in a higher absorbency in the slender (shorter) size for when they have heavy flows and for overnight.  If anyone finds them anywhere I\'d love to get some."
409,413,20070509,B005P0SMW8,5,"May 9, 2007",A38LWL7AIQN5JD,Acid Reflux help,This was recommended by my wife\'s chiropractor for acid reflux. It seems to be helping a lot. Amazon is the cheapest place to get it.
164,164,20111208,B0029NYQ6A,5,"December 8, 2011",A1JK78H8FM1G3C,these pad things,"I am a guy,we used things like this in Viet Nam,to wrap wounds.My daughter says she loves them.So I guess they are good.What can I say."
284,287,20110920,B003CP15AE,2,"September 20, 2011",A11EXFO14WEJM1,always Infinity pads are mostly useless,My wife tried these and had a number of complaints. She definitely would not recommend them let alone order more.- Not better or more absorbant than regular pads she normally uses- You have to pay special attention to the front and back.- Glue backing paper some times tears off instead of cleanly pealing off - annoying- Definitely not for heavy flow- Relatively expensive
157,157,20120207,B0029NYQ6A,5,"February 7, 2012",A3MX3VZIAGB0A,where have you been all my life?,"Like other reviewers I had been looking for the perfect overnight pad without a success. Then I ran into these by Always. And wow! these are it. I no longer have to worry about staying in one position all night and what not to avoid staining my clothes or bed.I\'m a medium pant size, so these Always pads cover back and front without problem and they\'re also wide enough in the center. But Always also came out with a Maxi pad for women size 14 and up which is a great idea too. Not all women have the same feminine needs so why do they have to stick to one-size-fits-all pad? They shouldn\'t have to. Kuddos to Always."
106,106,20111209,B0029NYQ1K,5,"December 9, 2011",A1UXLIX084LEDW,The Best Overnight Pad,"They are the most comfortable and absorbent overnight pads I\'ve ever used and great for heavy flow days. I noticed there was one very negative comment about them, but I have a hard time understanding that since I\'ve tried several of the other brands and have been deeply disappointed. They don\'t come close to working as well as the Infinity Overnights."
57,57,20120202,B001LK6XG8,1,"February 2, 2012",A3HRKDM9S54FAO,Hate These!,"The only positive thing I can say about these is they are long.  They are not soft like most pantiliners I\'ve used, but are very stiff.  They are extremely wide.  So wide, in fact, they  tend to curl under along the edges as they are worn.  I ordered through the subscribe and save program. Should have tried them first.  I will definitely be canceling that subscription."
148,148,20110928,B0029NYQ38,5,"September 28, 2011",A3OSJ0NY85ZSHF,Dependable,"These pads never leak and they are so thin you do not even notice that you are wearing a pad.  A little pricey, but worth it.  Save money by using amazon\'s subscribe and save program."
27,27,20110731,B001GCTTJY,5,"July 31, 2011",A2OLIJAR21U6DS,I love these!,"These are my favorite pads of all time! They are the perfect length, perfect width, perfect thickness and they hold a heavy flow! They don\'t break the bank either.. I usually always find them on sale and with a coupon and if I don\'t have either of those the regular price isn\'t bad either. I put a picture up for those who do not know what it looks like. I definitely recommend these pads ladies!"
330,333,20111122,B004J36GES,5,"November 22, 2011",A2WW57XX2UVLM6,No accidents!,"I\'ve used Always pads since they came out - it marked the first time in my life that I didn\'t have to throw away undergarments.What I love about these:- It\'s more comfortable than the old fashioned \'maxi\'.  Only someone who doesn\'t have a heavy flow would think these are bulky.  This is more comfortable than the comparable maxis that also make sure you don\'t have accidents.- Odor control is good, barely discernable (if you don\'t notice any odor, it\'s all good!)- Wide, so even without wings you don\'t get accidents.I\'ve had no accidents with these, and they\'re even good when you come home from the hospital after having a baby and don\'t want to use the monster-sized pads they give you."
41,41,20101126,B001LK6Q92,5,"November 26, 2010",A40ULZ7N0PKXZ,good product,I have been using this brand for long long time but this was the first time that I ordered it online. The shipping is FAST! I got it after I placed the order two or three days after. The overnight Always is incredible. It is very long but you will still feel very comfortable since it is very thin. It gives you 100% protection at night and even day time. The price is very reasonable as well. I usually buy it online but now I am considering to get it from this website. Great product.
121,121,20111216,B0029NYQ2E,3,"December 16, 2011",A2SLZMD0UYRT5X,ALWAYS WITH WINGS,These new pads are okay.They\'re a bit short in size.It does hold the volume required.But requires to use 2 pads for moderate protection.
208,208,20110915,B0029NYQB0,5,"September 15, 2011",A2CEOUMTN48ZLC,Bought for wife,Bought this for wife and since she didn\'t complain to me I will have to give it 5 stars!  Can\'t comment on anything else since I\'m a dude and don\'t use this.
350,353,20110915,B004J36GES,5,"September 15, 2011",A2B7BUH8834Y6M,"thin on size, thick on absorption","I\'ve always been paranoid about \'leaking\' in public or ruining upholstered furniture, etc. during that special time. I\'ve been a big fan of Always branded pads since they first came out. Nice channels direct flow to be absorbed before spilling over and they stay in place. I\'ve previously always gotten the thicker \'over night\' and \'extra long\' versions because of my over-the-top leak paranoia... but I gave these thinner pads a go and I did not have any incidents. I\'ve always avoided scented feminine products, because the last thing I\'d want to do  is attract attention to an area that needs no spectators or inquisitors. These pads really are \'lightly scented\' - just pleasant and not the over-powering all-familiar scent that is present in public bathrooms."
403,407,20080531,B005P0SMW8,5,"May 31, 2008",A2QXMEWCYVS50W,Good Golly George!,"This Aloe Vera is like spring water. It\'s very easy to use and has been very healing.  Our first knowledge of George\'s was a referral from a friend when my husband was undergoing radiation and dealing with the burns to his mouth. Since then I\'ve ordered gift bottles for family and friends also undergoing treatment.  Certainly it\'s not curative, but is soothing and helps deal with the side effects.  I think it\'s a good idea for general use, whether used as a topical or for drinking.  I prefer it cold but it doesn\'t need to be refrigerated. I think it\'s an amazing, easy to use product and highly recommend it for whatever reason."
213,213,20100112,B0029NYQB0,2,"January 12, 2010",A2RPD2V1JMWBCK,Really thin and tiny,"I am an adult, and I love this brand, but these were really small and thin."
294,297,20110910,B003CP15AE,4,"September 10, 2011",A234X1MVIMPMMC,Infinity and Beyond!!,"I was a little skeptical about this new product Always Infinity at first because Always is the only brand that I have ever used and I didn\'t want my product tampered with or improved because they were already perfect. I usually don\'t like improvements because to me that is usually code for taking away something good about the product in order to make a cheaper product to produce and cut back on the quality.  I have to say I was pleasantly surprised with how well the new technology worked to absorb away from your body. Even on my heaviest days I didn\'t have any leaks and I didn\'t feel bulky as I sometimes can feel. The new design has a wider back and channels that help with faster absorption. The only problem that I have with this product is that the adhesive is not strong enough on the wings, but besides that I think I can finally say I\'ve found an improvement I like. Great job Always."
257,259,20111019,B003CP1590,5,"October 19, 2011",AVIO9XD16BF1H,Absorbent,"Very comfortable to use, you won\'t know it\'s there.  Does as they\'re expected to.  Always is a very good brand to rely on."
232,233,20110216,B0029NYQEC,5,"February 16, 2011",A2ZJ835WQ7JNGT,best pantyliner,"This pantyliner is perfect for me because it is very absorbent, but is the size of a regular pantyliner, instead of a pad.  I use them daily between cycles.  These pantyliners have actually prevented yeast infections for me, which I was getting every several months with other pantyliners that were not as absorbent.  They always adhere very well for me.  All the stores where I shop stopped carrying the regular size, so I am so happy that Amazon carries these, and for a much better price than I was paying!  Always Dri-liners also makes a Long pantyliner, which is wider and longer.  I use those too when I need more coverage, like for light days of my cycle."
328,331,20111123,B004J36GES,5,"November 23, 2011",A2GY1YX6TQVJ0Q,male patient liked these,A male patient with episodic leakage of urine was desperate to find something comfortable for the needed times.  He found that the maxi pads were comfortable and worked well for him at night....better than the guards which would come unattached and irritate the area.
397,401,20091125,B005P0SMW8,5,"November 25, 2009",A3T09TSVAB9IYL,great product,"we use this in our home all the time- my oldest son uses it for acid reflux instead of his prescription- i use it for my younger son anytime he has an upset tummy, looses a tooth..... i have used it for animal illness issues, constipation - you name it .....it will help it."
398,402,20090614,B005P0SMW8,5,"June 14, 2009",A2QXMEWCYVS50W,A must have!,"This is a product it would do everyone well to have as a staple in their homes.  It offers instant relief from stomach discomfort yet tastes like good spring water.  I prefer it chilled and keep some always ready in my fridge.  It also works as a topical for cuts or irritations.Our first experience with the product was after radiation burns when my husband was in treatment.  As the saliva glands had been destroyed and he needed to cary a water bottle all the time, we were told about George\'s Aloe Vera (none other will work as well). This became his saving grace.There are many many uses, it\'s pure and has taken awards for its excellence.  I try not to be without it and have ordered it for friends and family, especially those who have been ill.Ordering via Amazon.com has always been the best way to get the product as it is not available locally.  Every vendor has been exceptional in getting it to me."
10,10,20110225,B001G7QSGQ,5,"February 25, 2011",A2KCD2PFUDXPPX,"Great product, excellent price","Always is a good brand, it holds up well, definitely superior to \'generic\', and the price is amazing, especially when you get a 15% discount for having it sent to you regularly. How convenient! And there are 3 packs of 44. No running to the store and paying a lot when you run out."
237,238,20100130,B0029NYQFG,5,"January 30, 2010",A3IZQWRULAKKMT,on line shopping is great,Here in red neck city where a thong is unheard of.We only have to go to Amozon . com to buy what we want.
382,386,20110719,B005P0SMW8,3,"July 19, 2011",A20BBSPE9T29J,Aloe vs. GERD,"I had hoped to go off prescribed medication and use the aloe instead for severe heatburn and acid indigestion. I lasted 4 days, then a little spicy lunch and I was vommiting for hours, so I\'m back on the meds. Don\'t expect the aloe to relieve heatburn as it is touted to do."
14,14,20090218,B001G7QUYQ,5,"February 18, 2009",A1GEXXQ9W3CS3H,Always trust my Always,"I only trust Always brand.  These are indeed ultra thin and long and yet never feel too thin and does the job.  I never have to worry, even without the wings."
345,348,20110922,B004J36GES,3,"September 22, 2011",A28RHTOOW04O6M,Not the best out there,"Overall, it doesn\'t offer anything new that isn\'t already out there.  What\'s missing is the wings, I have to agree with other reviewers.  Also, it\'s really thick, in fact, thicker than baby\'s diapers!  I suppose \'super\' is supposed to be thicker, but without wings, they tend to move around (or up in this case)."
359,362,20110904,B004J36GES,4,"September 4, 2011",A2SNRRXE9M9ZDY,An effective product,"These are lightly scented (not overpowering, not irritating) and very absorbent.  They were comfortable, even for someone like me who typically uses thin pads.  I\'m pretty picky when it comes to feminine products, but this is a product I wouldn\'t hesitate to purchase."
336,339,20111020,B004J36GES,5,"October 20, 2011",A1WKEAS58297E5,Does the job!,"What can you say about pads? Either they do the job or they don\'t. These do the job! We were happy with their performance under such \'conditions.\' We have two pad-wearing females in our house and I have to say, we go through the sanitary napkins. As always, this is the best brand. Always brand seems to do the best job providing protection from embarrassing messes and odors."
102,102,20120326,B0029NYQ1K,5,"March 26, 2012",AES4FWKNAHZYJ,These are wonderful,"I hate my time of the month. Who doesn\'t? But these pads are great for the entire time. They\'re very long, so they prevent leaks quite well. They\'re great for overnight or for the daytime. They\'re very thin, so it doesn\'t feel like you\'re wearing a diaper all day. And they are very absorbent, and they do wick moisture away from your body very quickly. I don\'t have to worry with these. This is a great product at a great price, and with the subscribe and save, it\'s an ever better deal. And it\'s not like you won\'t go through them."
78,78,20120324,B0029NYPXO,5,"March 24, 2012",AYMRN27MH5IJ0,Good Product,The wipes could stand to be a bit bigger but overall its a good product.  Does what it\'s suppose to do and its a GREAT deal for the price. I ran out and decided to look on amazon to see if I can get it at a good price and yes I did. I keep a few in My purse at all times.  Good product if you want that fresh feeling at all times.
