,id_review,date,product_id,user_rating,date_other_format,user_id,title,review
180,180,20110424,B0029NYQ6A,5,"April 24, 2011",A267SPU8FBONBU,These are a god send!!!!,"On my quest to fight an overnighter that truly does provide protection, this was my last stop! They truly provide maximum protection! As the other reviewers before me stated, I too had to use towels, double up on overnight pads and use a tampon just to go to sleep without the worry of staining! I am truly glad Always decided to make a product that delivers! I hated going to bed with a tampon, risking getting Toxic Shock syndrome, but it was the only thing that somewhat worked.There is nothing bad to say about this product! I don\'d mind the bulkiness of it, nor do I mind the length of it.Side Bar: But one thing I do have to note is that my menstrual started getting lighter since being diagnosed with anemia and taking iron pills daily. A heavy period is not normal, so for those experiencing a heavy cycle, check with your doc.A lot of my symptoms (extreme cramping, heavy clotting, heavy flow, etc), besides PMS, have subsided since taking iron pills, working out and eating more healthy foods. I keep these pads on deck and only use these pads maybe once during my cycle on my most heavy day, which isn\'t nearly as heavy as it once was. So they have lasted me for quite a while.Sorry for the side bar, but I had to add that in there in case some of you have been wondering why you are having such heavy cycles.At any rate, this product works! Go out and get it and keep it in stock for your just in case days!"
39,39,20110108,B001LK6Q6K,5,"January 8, 2011",A2295MGUTKMBW9,Only Always for me,"The first few years I have the menstrual cycles, I tried every brands out there but at the end, I came back to \'Always.\'\'Always\' just felt more comfortable and breathable than the rest.So for the past (and all future) decades, I only use \'Always\'"
191,191,20100820,B0029NYQ6A,3,"August 20, 2010",A2BLRRNYU9XO9R,"Pretty Good, Pretty Good","Like the majority of women who try out this product, I have been experiencing very heavy periods since I began puberty. Finally tired of wearing an overnight level absorbancy pad and a tampon just to be on the safe side, I decided to find another option. I saw a package of Always Overnight Extra Heavy Flow Maxi pads at my local Wal-Mart, and I thought it wouldn\'t hurt to try them out. W-o-w. First of all, this is a VERY long pad. It is about the length of two Always Ultra-Thin Overnight pads stuck together, and it pretty much expands from the top of my underwear to the back of them. Another helpful feature is that this pad contains two sets of wings--one in the middle like traditional pads and another set at the back. While, these pads DEFINITELY prevent leaks, I have a few complaints about this product. First of all, I\'ve noticed that when you remove the pad, it leaves a thin adhesive strip on your underwear that is hard to remove. So, though these pads keep you from having accidents, I still do not recommend that you wear your good underwear while using them.  Also, it is pretty hard to descreetly carry these in your purse, as they are VERY large. But other than that, I feel that they are an amazing product. Surprisingly, these pads don\'t feel like a diaper when I am wearing them, so that is a plus. However, I feel that women who are any smaller than a size twelve or fourteen might find them to be quite bulky, so I would take that into consideration. Also, if you are a woman who is already sticking two maximum coverage pads together just to feel comfortable, this maxi pad has about the same effect, so it will not be anything new to you. But overall, I will purchase these in the future."
370,373,20120420,B005P0SMW8,2,"April 20, 2012",A1DIFL0333QPEB,Hmmm...,"I\'m a HUGE fan of Aloe Vera.  I\'m a big fan of Chinese Medicine as well.  I\'m a liver type.  I often get what the chinese call \'Liver Yang Rising\', which results in a lot of hot tempered conditions.  Aloe Vera is very Yin tonifying, and it\'s always brought me great balance.  I love it.I was in the Vitamin Store, and saw this George\'s aloe.  I always buy the Lily of the Desert stuff, but this caught my eye, and I bought it. The price was similar in comparison.  I thought, what the heck, I\'ll give it a try.I\'m about 2/3 of the way through the bottle, and I now realize that I notice NONE of the beneficial Yin tonifying effects that traditional Aloe Vera Juice gives you.  Pretty much none whatsoever.  This Aloe tastes like distilled water.  Has no taste whatsoever.  A good part of Aloe\'s medicine is in the bitter.  All medicines in nature have a bitter tasting element to them.  Bitter is healing.  When you remove the bitter, I\'m not so sure it\'s healing anymore.I was reading through the testiominals on here, and they all seem stomach related.  Perhaps it has a beneficial effect on stomach woes, but since I don\'t have any, it did nothing for me.  It had no effect on my Liver Yang Rising, and I feel like the cooling, Yin tonifying effects just aren\'t there with this aloe.Not a big deal, wasted some money, but I\'m going right back to Lily of the Desert."
167,167,20111125,B0029NYQ6A,5,"November 25, 2011",A2O4BQG715EDZL,Best overnight protection for heavy flow,"I have very heavy periods and I\'ve been searching for an overnight pad for years. I\'ve tried many, many brands but NOTHING worked. They claim they are \'super long\', \'heavy duty\', \'overnight\', but there were still leaks! Luckily I found this one. It\'s the only pad that really works!!! It\'s amazing. Some reviewer complained that it\'s like a diaper, I guess she does not have heavy period like me. It works because it is long and thick - thus looks like a diaper. I\'m so happy that I\'ve finally found THE overnight pad for me."
373,377,20120127,B005P0SMW8,5,"January 27, 2012",A88QNRREGIPXK,Little to no Taste Yeah!,George\'s definatly is the best Aloe Vera Juice I have tasted. It has little to no taste and is easy on the palette and good for stomach issues.
385,389,20110517,B005P0SMW8,5,"May 17, 2011",A3SRWH192IV3MG,Excellent Product,This is great for anyone with digestive problems. It taste like water which means it doesn\'t have a flavor to it. This brand is the only one that is flavorless. The others I\'ve tried are bitter.
392,396,20101011,B005P0SMW8,5,"October 11, 2010",A22LCHGZP7XI3V,the very best product for irritable bowl.,The very best product if you have irritable bowl. I drink 1/2 c daily at night before bed and have no further issues.
143,143,20120203,B0029NYQ38,5,"February 3, 2012",A1ACUWQJ09ZITY,The best product I used ever!!!,This is the best product I used ever!!!  I don\'t need to worry about anything when I wear it. It is soft and very comfortable. I definitely will recommend it to my friends.
147,147,20111102,B0029NYQ38,5,"November 2, 2011",A3S15YGZ6W6EV2,Better than any alternative that I\'ve found.,"I found these pads to be the best option for \'stuff\', by far. They are soft, absorbent, and are superb at keeping me clean and fresh. They cost a bit more than other alternatives, although I think it\'s well worth the confidence I have, knowing that I\'ll never have a problem when I use these.One gotcha:  Keep quiet if you bring a box of these to work and keep them in your desk. Less-prepared co-workers will beg, borrow and (usually) steal them once they discover how well they work.  This brings up the cost per use (for you) up by a whole lot.  I suggest hiding the contents of the box in an old Pampers wrapper.  This will keep all your co-workers far away from your \'stuff.\'"
40,40,20100716,B001LK6Q6K,5,"July 16, 2010",ABWWX6IWGD663,Great product,This is the only brand that I have been using for the last several years. No complains!
212,212,20100610,B0029NYQB0,5,"June 10, 2010",A1RMBTUIGOAFGV,Perfect for daily use,"Yes, this one is a little bit smaller size than the regular size, however, for me who normally wear g-string during the day, it is just perfect.  I definitely like the scented ones, and price on this is the best!"
138,138,20100514,B0029NYQ2E,5,"May 14, 2010",A2FAQKTKUNXSEQ,"OMG! So SOFT, GREAT PROTECTION, Doesnt irritate like others!","First of all, I love these because it doesnt irritate you like all other pads out there. I love Always, and have always used this brand, but now I will never use anyother class from Always except the Infinity. These Always infinity does its job! I use to use the bulky kind the first few days, as I am extremely heavy, then the regular thin ones the last couple days, but they would irritate me so bad! I would literally have a \'diaper rash\' down there. But one day I sent my husband to the store to buy me some, and he brought me the Infinity. I was at first disappointed because they were so thin! I did not expect them to work so darn well! My husband was so scared that it wouldnt work and that I would be upset with him for buying the wrong ones, but I am now soooo glad he did. I will never use anyother ones besides these Infinity.Mainly because they are so soft. It feels like those packing styrophome thin sheets that they wrap around the TV screen when you first open the box. That type of smooth and cushiny type feel, just thicker than this sheet. And when I finally ran out, I had to borrow my moms other thins pads (not the infinity) and I only used it for two days and it irritated me again. So if you have that problem, get these. The really really absorb and are exremely soft! Its like magic. I dont see how its possible that it can absorb so much but it does!"
402,406,20090407,B005P0SMW8,5,"April 7, 2009",A182W88RBNZV0G,Great Stuff,This product is very good for the digestive system. My husband and I use it. Just like drinking water and you dont have to keep it in the frig.
233,234,20101217,B0029NYQEC,5,"December 17, 2010",AJHZIDMAHHIWZ,It\'s a pantyliner!!!,I use this product on a daily basis in between my cycles.  Have been using this product for over a year and I\'m completely satisfied.  They\'re thin and very absorbent.  They don\'t stick to your body like other liners have a tendency to do.
321,324,20111230,B003CP15O0,3,"December 30, 2011",A1CT2OAWCDIS3T,Stick to underwear leaving pieces behind,"These pads have good absorbency but tend to stick to my underwear, making changing and removal very difficult. I am wearing 100% cotton underwear. The pads often leave pieces stuck to underwear which are extremely difficult to remove. Other than that, the pads are fine."
58,58,20110929,B001LK6XG8,5,"September 29, 2011",A1GCOURMTPXKWI,Perfect liner,"I like these so much, that I am signed up for regular delivery.  They are definitely much larger (width and length) than any liners I have ever used, and they are very absorbent, so you continue to feel fresh.  I hope they never stop making them."
262,264,20110408,B003CP1590,5,"April 8, 2011",A1QBOC76MIOJYP,Good choice,"These pads are a good choice if you want exactly what the product description states - thin, long, super absorbency pads with wings.No leakage, comfortable fit. It stays in place without shifting or bunching/crinkling up. Great for overnight too since they are long. They also allow you to \'breathe\' .. they do not cause excess sweatting.Perhaps a bit TMI, but this info is important to the product performance I believe - These are the first pads my daughter can use without any leakage - they are good for extra heavy flow.Amazon has a great price on these jumbo packs."
378,382,20111112,B005P0SMW8,5,"November 12, 2011",A4BRTHMNNVXHU,Great Product,"I tried this product to releave my heartburn symptoms as nothing else seem to work.  After drinking it for about 3 weeks my heartburn was gone.  I have been drinking this for over a year now.  Some days I have mild heartburn but for the most I am heartburn free.  If you have this problem, I would recommend trying it."
310,313,20110829,B003CP15AE,5,"August 29, 2011",A3BVDW4DOLJAN0,Always Infinity always works!,"I\'ve been a huge fan of Always ever since they came out with the \'wings,\' which are a really life saver. I wasn\'t sure at first about spending a little extra money to get Always Infinity instead of the regular Always pads. However, now I will purchase nothing else.Even on the heaviest of days, Always Infinity is super absorbent, keeps you dry, and takes away all worries of stains or leaks.  Don\'t let the thinness of these pads fool you. Always Infinity pads can hold a lot.Also, because they are so thin they do not show through clothing or feel bulky.I highly recommend Always Infinity."
368,371,20111228,B004J3A7SY,5,"December 28, 2011",AO4OIK8IVUXAP,Fast shipping,I received these pretty quickly. The price was good and a little bit cheaper than buying in the store. Convenient not having to leave the house.
334,337,20111109,B004J36GES,4,"November 9, 2011",A2OJCTT5WLB2HR,"Works well, but bulky","I must be in the minority because I really hate pads with wings so I was thrilled that these didn\'t have them.  I have had no issues with leakage and the scent is pleasant without being overpowering.  My only complaint is that they are pretty bulky.  There are other pads on the market that absorb as well and as much without the bulk of these.  When I opened the box I was actually surprised at how big the package was for 20 pads, but that is due to how thick they are.  But, overall, they do the job and if the thickness doesn\'t bother you, I think you\'ll be very happy with the quality of the product."
226,227,20120316,B0029NYQEC,5,"March 16, 2012",A25Y9AZCEI6JW6,I paid $5 with free shipping (prime) on it.,GReat Product & GReat Deal!!This is a deal you will not find in any stores..i am satisfied with the product as well. Thanks always and amazon for always helping consumers get what they want at the price they can afford(ugh i sound like a cheesy commericial slogan writer) but its true.the subscribe and save really works well for me for most stuff
225,226,20120318,B0029NYQEC,3,"March 18, 2012",ARRCMSQU4BX91,great product but bad packaging,as the title: great product; but it\'s pretty inconvenient to use without individual packaging. I\'ll buy again if they improve the packaging.
88,88,20110626,B0029NYPY8,4,"June 26, 2011",A3JMLA2CJAHQ1A,Great to freshen up,"These are great for quick fresh ups.  I keep them on the back of the toilet and use them as a way to quickly freshen up, or for clean up...after... :o)  My boyfriend even uses them for himself.  I won\'t go without having wipes in the bathroom anymore.  I\'m not a huge fan of the scent, but oh well."
124,124,20111103,B0029NYQ2E,2,"November 3, 2011",A37XHG5LLONQH2,"no comfortable, too thick",It is too thick and I fell quite uncomfortable with it.It is my mistake to choose this one. It may suit for someone who sit all day.
384,388,20110702,B005P0SMW8,3,"July 2, 2011",AT0IX8J6ZCH1D,Doesn\'t work for everyone,"I have had IBS and acid reflux for the majority of my adult life and have taken prescription medication (Nexium right now) for around 10 years.  My wife bought this for me to see if it would help one or both problems.  I was only able to take it for ten days, at 4 oz, twice a day before I started to have a generalized itchy rash on my arms and legs.  I stopped on day 11 when I figured it out: i am probably allergic to aloe.  Sure enough, the rash went away.  Maybe if I had more time, it could have helped me, but there was no noticeable difference in any of my digestive problems for those 10 days.  Tasted like water, so pleasant enough, but it just didn\'t do what I hoped."
171,171,20110930,B0029NYQ6A,5,"September 30, 2011",A2FV5YQV866PVF,Excellent Overnight Protection,"This is a review of a \'feminine product\' so there may be \'too much information\' for some readers.Before I tried this particular overnight pad, I would have to double layer the \'thin\' or \'regular\' thickness overnight pads in order to not bleed through during the night. Heavy and extra heavy pads were never absorbent enough. The similar sized (i.e. extra thick) pads would not stay fitted properly and caused leaks. The thicker pads I tried also twisted around to adhesive side up which was both very uncomfortable and caused them to not absorb correctly, so was also messy. I am concerned about toxic shock syndrome so I do not use tampons. I tried every brand of \'overnight\' or \'extra heavy\' pads out there at the time and none of them were up to it. I found these about three years ago and have not tried another heavy flow overnight pad since.With these Always brand Overnight Extra Heavy Flow with Wings I never have to use more than one at a time. I\'ve never had leaks when using these pads and I don\'t have problems with them twisting around to adhesive side up. If you have extremely heavy menstrual flow then you should try these pads.It is true that they are extremely long and very thick. The pad length is such that some cuts of underwear will be too small (or short) in the back if you place the pad correctly. This causes the pad to overhang or stick out of the back of the underwear. This is remedied easily, but can be inconvenient. If this is something that you cannot stand then you should not get these pads.Regarding price, currently Amazon is offering a two pack for about 12 dollars. I\'ve seen big differences in price depending on where you get them (between 12 -20 for one pack)this is the lowest price I have seen so far (about 6 dollars for one pack)."
268,270,20111111,B003CP15AE,3,"November 11, 2011",A1DC1O4VX6AHPP,prefer the regular Always Ultra Thin,"I\'ve used Always since they first came out when I was a teen, and I usually like the product.  This particular Infinity type, though, just isn\'t as good as the \'regular\' Always pads.  The wings were positioned in a very awkward way that made the fit less than optimal.  The absorbancy wasn\'t as good, which made the pad very uncomfortable after a short amount of time.  Fluid doesn\'t wick to other parts of the pad, either.  I get longer and more comfortable use out of Always Ultra Thin and will stick with those."
197,197,20120318,B0029NYQ9W,1,"March 18, 2012",ARRCMSQU4BX91,too thin,"this product is too thin, not good enough for light or even between days.  won\'t buy again. can find better ones."
189,189,20101103,B0029NYQ6A,5,"November 3, 2010",A1SSQ9HBQNWZ5K,Finally! A Real Overnighter!,"Like many women who have heavy periods, I had used two pads to cover front and back, so I could turn in my sleep without leakage. But even with that, and a tampon, still had to have towels or something just in case. Now, even on heavy nights, this plus a tampon gets me through. Oh, I still have the towel, because I\'ve woken too many nights to find sheets stained...  and I\'m nervous.lol. But so far the length of this pad, and the differently-designed back -- it\'s wider than the front of the pad -- have gotten me through. I remember looking at other products and thinking, \'Have the designers of these ever even SEEN a woman\'s body?\' lol. This is much better."
161,161,20111231,B0029NYQ6A,5,"December 31, 2011",A2AWZ10ZWPJUXC,Always Maxi Overnight Extra Heavy Flow with Wings,No matter what brand of pads I buy I come back to Always. These pads do protect overnight and you can sleep instead of making all those trips to the bathroom at night. If you have a problem with super extra heavy flow nothing is going to work but if not use these. I like the added feature of wings as they provide extra protection. The adhesive strip is really strong and they won\'t slip. I wouldn\'t buy any other pad but Always as they\'re reliable and top quality. You can\'t get any better. It\'s worth it.
270,272,20111020,B003CP15AE,5,"October 20, 2011",A21BVL7PKG9BX8,Comfortable and thin,"I\'ve been using Always Infinity Pads for some time now and of all the different pads I\'ve tried over the years, I have found these to be the most comfortable. They are super thin, great absorbancy and comfortable to wear. They are great for those who have a heavier flow. I have never had any embarrassing leaking while using these pads. I\'ve played sports while wearing them and done normal activities also and they stay in place. Great product for something that\'s not so great to have to deal with."
206,206,20120322,B0029NYQB0,3,"March 22, 2012",A3UEYY5XATXCL7,too scented,"Usually I like scented feminine stuff, but his is too much. And these are really light - quite short and very thin.I just finished these. And I am back to Costco Kirkland\'s, simple and perfect, no scent though, but after these scented ones I really wanted some break of them!"
84,84,20120416,B0029NYPY8,5,"April 16, 2012",A34BW46C2TMRT3,Always Fresh and Clean!,I bought this product at target just to try it out and it was on sale. I started using it and I was really happy with it. I am a loyal customer of always and this product is great to take in your purse and keep in your bathroom. I already had the container from my target purchase so I bought the refill packs and it was a great price. I still have some left and I keep them with me at all times. Great buy! will definitely repurchase :-)
369,372,20110726,B004J3A7SY,5,"July 26, 2011",A33E3VMVB3GSNP,Love it!,"I finally found a panty liner made for bigger ladies. It stays on the panty, does not shift around, a huge plus for me."
21,21,20120211,B001GCTTJY,4,"February 11, 2012",A3P3MV4BV78TRO,Sometimes creat itch,"Generally it is good. The surface is dry. Most of time, it is comfortable to wear it, but you need to change pads often. This pads cannot hold much, and cannot last long. Sometimes it creates itch. Again you have to change pads often (at least once every two hours)."
12,12,20120406,B001G7QUYQ,1,"April 6, 2012",A7NI5MXWOLLJX,Always Ultra Long/Super Without Wings,"All I can say is Ultra Long is correct...exactly how big is the woman that\'s supposed to wear those things!!! Even the largest of women would find those things ridiculous, and I\'m not a large woman at all...they\'re almost too big for my underwear, and they don\'t adhere to anything. This is one of the worst Always products I\'ve ever bought."
75,75,20110716,B0029NYPUC,1,"July 16, 2011",A2F09EWKV3MTO2,Hate these pads- irritating to my skin,"I am slender framed woman and want a pad that isn\'t overly large. These pads are very thin, but unfortunately Always makes their pads with a strange texture that makes it feel as if you are wearing plastic. Not very comfortable and caused irritation. Will not buy these or any other Always pad again."
25,25,20111107,B001GCTTJY,5,"November 7, 2011",AZXKAH2DE6C8A,Love it,"They might be thin, but they are very absorbent. Plus they are so thin as to not be bulky and cumbersome. I really like the confidence they give me to do their job all through the night."
363,366,20120331,B004J38FEM,1,"March 31, 2012",A1B51VHN18WZDK,Beware - These Are (Horribly) Scented!,"Nowhere in Amazon\'s description does it say that these are scented. I didn\'t realize it until I tracked the sickly sweet odor coming from my purse to an emergency liner I\'d stashed there. I checked Amazon again and discovered that if you zoom way in on the product photo, you can see \'lightly scented\' written in tiny letters at the bottom. I\'m hoping they still make these in an unscented version, because the scented ones smell like formaldehyde."
340,343,20110929,B004J36GES,4,"September 29, 2011",A3C6CZC2JP67VK,They do what they suppose to.....,"I wasn\'t too keen about these maxi pads but being in that I participate in this program it gave me the opportunity to try them anyway. Like many others,  I normally use the ultra-thin pads with wings. These pads are thicker than ultra thins though, but still comfortable and not like I\'m wearing my 11 month old diapers. I was concerned about leakage without wings, but after using these I\'ve decided wings are required for ultra thins but not these maxis. These pads are a go, so I too recommend them."
295,298,20110910,B003CP15AE,4,"September 10, 2011",A3M7R4PD0FEPUB,Easiest winged napkin to use.,"I usually hate pads with wings, but they\'ve made these pads incredibly easy to use. There is only strip of paper over the wings to deal with and you don\'t have to worry about pulling it off until the pad is already secure. I do prefer the scented pads, but these are quite absorbent without feeling heavy, so it\'s an easy trade-off.  These are by far the most thoughtfully packaged pads as well.  You simply open at the tab and pull off the pad.  Genius.I think the equivalent Stayfree pads feel fresh longer and last a little longer, but these pads feel thinner."
